### ISSUE TITLE
Be notified on account creation

### ISSUE THREAD

**Issue by Benjamin-Loison** [Benjamin-Loison/gitea#178]
### Feature Description

To give access to repositories for instance.

https://gitea.lemnoslife.com/-/admin/hooks does not seem helpful.

Related to #130 and #165 (it does not help).

+5

**Comment by Benjamin-Loison** [comment]
https://gitea.lemnoslife.com/-/admin/monitor/queue/11 (`webhook_sender`)

So no entry of https://gitea.lemnoslife.com/-/admin seems useful.

**Comment by Benjamin-Loison** [comment]
https://gitea.lemnoslife.com/user/settings/hooks does not seem useful as well.

**Comment by Benjamin-Loison** [comment]
Related to [Benjamin_Loison/authentik/issues/4](https://codeberg.org/Benjamin_Loison/authentik/issues/4).

**Comment by Benjamin-Loison** [comment]
An alternative would be to trigger a command/script on SQL `INSERT`/`UPDATE` (maybe in my case) in the Gitea table of users.

<details>
<summary>The person:</summary>

```
-----BEGIN PGP MESSAGE-----

hF4DTQa9Wom5MBgSAQdAtPFxd2T44fVvebY/170e4fLrCmqf3fkQzj23QCNtj0Yw
+GpbKJ92OXkXn6wmLfe9PfSJpjfRFs+K6aMoxAYzLAN97TcbTvQSzH3IYM8u14Mx
0kABHOGbbse7UspEkTh6M/F2/Kh1YBqvVOHpxeEk5hDw8GRhWZ4gj5CDBhW4JKbt
SKpLe7wrouuitDb/ebICE2wX
=+cOE
-----END PGP MESSAGE-----
```
</details>

has only implemented some at school and it was not for running arbitrary code as I want but may be interested if I figure this out it seems.

See [Benjamin_Loison/mysql/issues/14](https://codeberg.org/Benjamin_Loison/mysql/issues/14).

**Comment by Benjamin-Loison** [comment]
While I monitored new GitLab user account on my instance, I never did for Gitea according to Git history of names of tracked files in [OverClock3000_notifications](https://codeberg.org/Benjamin_Loison/OverClock3000_notifications).

**Comment by Benjamin-Loison** [comment]
I suspect that can monitor logs but this requires administrator access.

**Comment by Benjamin-Loison** [comment]
Modifying Gitea code should make that pretty easy but it is not what I want it seems.

**Comment by Benjamin-Loison** [comment]
DuckDuckGo search *python detect network packet*.

**Comment by Benjamin-Loison** [comment]
https://peerdh.com/blogs/programming-insights/implementing-network-packet-sniffing-with-python-and-scapy

[PyPi: scapy](https://pypi.org/project/scapy/)
[scapy](https://github.com/secdev/scapy) has 11.4k stars and last commit was 4 days ago.

**Comment by Benjamin-Loison** [comment]
```bash
pip install scapy
```
<details>
<summary>Output:</summary>

```
Collecting scapy
  Downloading scapy-2.6.1-py3-none-any.whl.metadata (5.6 kB)
Downloading scapy-2.6.1-py3-none-any.whl (2.4 MB)
   ━━━━━━━━━━━━━━━━━━━━━━━━━━━━━━━━━━━━━━━━ 2.4/2.4 MB 55.5 MB/s eta 0:00:00
Installing collected packages: scapy
Successfully installed scapy-2.6.1
```
</details>

**Comment by Benjamin-Loison** [comment]
https://scapy.readthedocs.io/en/latest/installation.html#installing-scapy-v2-x mentions the `pip` package.

**Comment by Benjamin-Loison** [comment]
<details>
<summary>Python script:</summary>

```python
from scapy.all import sniff

def packet_callback(packet):
    print(packet.summary())

# Sniff packets on the default interface
sniff(prn=packet_callback, count=10)
```
</details>
<details>
<summary>Output:</summary>

```
Traceback (most recent call last):
  File "/home/benjamin_loison/sniff.py", line 7, in <module>
    sniff(prn=packet_callback, count=10)
  File "/home/benjamin_loison/venv/lib/python3.11/site-packages/scapy/sendrecv.py", line 1424, in sniff
    sniffer._run(*args, **kwargs)
  File "/home/benjamin_loison/venv/lib/python3.11/site-packages/scapy/sendrecv.py", line 1273, in _run
    sniff_sockets[_RL2(iface)(type=ETH_P_ALL, iface=iface,
                  ^^^^^^^^^^^^^^^^^^^^^^^^^^^^^^^^^^^^^^^^
  File "/home/benjamin_loison/venv/lib/python3.11/site-packages/scapy/arch/linux/__init__.py", line 218, in __init__
    self.ins = socket.socket(
               ^^^^^^^^^^^^^^
  File "/usr/lib/python3.11/socket.py", line 232, in __init__
    _socket.socket.__init__(self, family, type, proto, fileno)
PermissionError: [Errno 1] Operation not permitted
```
</details>

as expected like WireShark.

**Comment by Benjamin-Loison** [comment]
[scapy/blob/0648c0d36ad7e613e7a4014fe89d8829ad50df83/README.md?plain=1#L46](https://github.com/secdev/scapy/blob/0648c0d36ad7e613e7a4014fe89d8829ad50df83/README.md?plain=1#L46) confirms the `root` need.

**Comment by Benjamin-Loison** [comment]
```bash
sudo python3 sniff.py 
```
<details>
<summary>Output:</summary>

```
Ether / IP / TCP XXX.XXX.XXX.XXX:39072 > 192.168.1.20:https A
Ether / IPv6 / TCP XXXX:XXXX:XXX:XXXX:XXXX:XXXX:XXX:XXXX:ssh > XXXX:XXXX:XXX:XXXX:XXXX:XXXX:XXXX:XXXX:52520 PA / Raw
Ether / IPv6 / TCP XXXX:XXXX:XXX:XXXX:XXXX:XXXX:XXX:XXXX:ssh > XXXX:XXXX:XXX:XXXX:XXXX:XXXX:XXXX:XXXX:52520 PA / Raw
Ether / IPv6 / TCP XXXX:XXXX:XXX:XXXX:XXXX:XXXX:XXX:XXXX:ssh > XXXX:XXXX:XXX:XXXX:XXXX:XXXX:XXXX:XXXX:52520 PA / Raw
Ether / IPv6 / TCP XXXX:XXXX:XXX:XXXX:XXXX:XXXX:XXX:XXXX:ssh > XXXX:XXXX:XXX:XXXX:XXXX:XXXX:XXXX:XXXX:52520 PA / Raw
Ether / IPv6 / TCP XXXX:XXXX:XXX:XXXX:XXXX:XXXX:XXX:XXXX:ssh > XXXX:XXXX:XXX:XXXX:XXXX:XXXX:XXXX:XXXX:52520 PA / Raw
Ether / IPv6 / TCP XXXX:XXXX:XXX:XXXX:XXXX:XXXX:XXX:XXXX:ssh > XXXX:XXXX:XXX:XXXX:XXXX:XXXX:XXXX:XXXX:52520 PA / Raw
Ether / IPv6 / TCP XXXX:XXXX:XXX:XXXX:XXXX:XXXX:XXX:XXXX:ssh > XXXX:XXXX:XXX:XXXX:XXXX:XXXX:XXXX:XXXX:52520 PA / Raw
Ether / IPv6 / TCP XXXX:XXXX:XXX:XXXX:XXXX:XXXX:XXX:XXXX:ssh > XXXX:XXXX:XXX:XXXX:XXXX:XXXX:XXXX:XXXX:52520 PA / Raw
Ether / IPv6 / TCP XXXX:XXXX:XXX:XXXX:XXXX:XXXX:XXX:XXXX:ssh > XXXX:XXXX:XXX:XXXX:XXXX:XXXX:XXXX:XXXX:52520 PA / Raw
```
</details>

**Comment by Benjamin-Loison** [comment]
```python
sniff(prn = packet_callback, filter = 'port 3306', count = 1)
```

Source: [Wikipedia: List of TCP and UDP port numbers#Well-known ports (1287409738)](https://en.wikipedia.org/w/index.php?title=List_of_TCP_and_UDP_port_numbers&oldid=1287409738#Well-known_ports)

does not return on Gitea user creation.

Note that the source also states that it is TCP.

**Comment by Benjamin-Loison** [comment]
<details>
<summary><code>/etc/gitea/app.ini</code>:</summary>

```ini
...

[database]
DB_TYPE = mysql
HOST = 127.0.0.1:3306
NAME = gitea
USER = gitea
PASSWD = CENSORED
SCHEMA = 
SSL_MODE = disable
CHARSET = utf8
PATH = /var/lib/gitea/data/gitea.db
LOG_SQL = false

...
```
</details>

**Comment by Benjamin-Loison** [comment]
DuckDuckGo search *scapy port*.

**Comment by Benjamin-Loison** [comment]
```python
help(sniff)
```
<details>
<summary>Output:</summary>

```
Help on function sniff in module scapy.sendrecv:

sniff(*args, **kwargs)
    Sniff packets and return a list of packets.
    
    Args:
        count: number of packets to capture. 0 means infinity.
        store: whether to store sniffed packets or discard them
        prn: function to apply to each packet. If something is returned, it
             is displayed.
             --Ex: prn = lambda x: x.summary()
        session: a session = a flow decoder used to handle stream of packets.
                 --Ex: session=TCPSession
                 See below for more details.
        filter: BPF filter to apply.
        lfilter: Python function applied to each packet to determine if
                 further action may be done.
                 --Ex: lfilter = lambda x: x.haslayer(Padding)
        offline: PCAP file (or list of PCAP files) to read packets from,
                 instead of sniffing them
        quiet:   when set to True, the process stderr is discarded
                 (default: False).
        timeout: stop sniffing after a given time (default: None).
        L2socket: use the provided L2socket (default: use conf.L2listen).
        opened_socket: provide an object (or a list of objects) ready to use
                      .recv() on.
        stop_filter: Python function applied to each packet to determine if
                     we have to stop the capture after this packet.
                     --Ex: stop_filter = lambda x: x.haslayer(TCP)
        iface: interface or list of interfaces (default: None for sniffing
               on the default interface).
        monitor: use monitor mode. May not be available on all OS
        started_callback: called as soon as the sniffer starts sniffing
                          (default: None).
    
    The iface, offline and opened_socket parameters can be either an
    element, a list of elements, or a dict object mapping an element to a
    label (see examples below).
    
    For more information about the session argument, see
    https://scapy.rtfd.io/en/latest/usage.html#advanced-sniffing-sniffing-sessions
    
    Examples: synchronous
      >>> sniff(filter="arp")
      >>> sniff(filter="tcp",
      ...       session=IPSession,  # defragment on-the-flow
      ...       prn=lambda x: x.summary())
      >>> sniff(lfilter=lambda pkt: ARP in pkt)
      >>> sniff(iface="eth0", prn=Packet.summary)
      >>> sniff(iface=["eth0", "mon0"],
      ...       prn=lambda pkt: "%s: %s" % (pkt.sniffed_on,
      ...                                   pkt.summary()))
      >>> sniff(iface={"eth0": "Ethernet", "mon0": "Wifi"},
      ...       prn=lambda pkt: "%s: %s" % (pkt.sniffed_on,
      ...                                   pkt.summary()))
    
    Examples: asynchronous
      >>> t = AsyncSniffer(iface="enp0s3")
      >>> t.start()
      >>> time.sleep(1)
      >>> print("nice weather today")
      >>> t.stop()
```
</details>

**Comment by Benjamin-Loison** [comment]
DuckDuckGo search *BPF filter*.

**Comment by Benjamin-Loison** [comment]
[Wikipedia: Berkeley Packet Filter (1285361111)](https://en.wikipedia.org/w/index.php?title=Berkeley_Packet_Filter&oldid=1285361111)

**Comment by Benjamin-Loison** [comment]
DuckDuckGo search *BPF port*.

**Comment by Benjamin-Loison** [comment]
```bash
ifconfig
```
<details>
<summary>Output:</summary>

```
...
lo: flags=73<UP,LOOPBACK,RUNNING>  mtu 65536
        inet 127.0.0.1  netmask 255.0.0.0
        inet6 ::1  prefixlen 128  scopeid 0x10<host>
        loop  txqueuelen 1000  (Local Loopback)
        RX packets 292447350  bytes 204996745010 (190.9 GiB)
        RX errors 0  dropped 0  overruns 0  frame 0
        TX packets 292447350  bytes 204996745010 (190.9 GiB)
        TX errors 0  dropped 0 overruns 0  carrier 0  collisions 0
...
```
</details>

**Comment by Benjamin-Loison** [comment]
```python
sniff(prn = packet_callback, iface = 'lo', count = 1)
```
```
Ether / IPv6 / TCP ::1:44734 > ::1:3006 S
```

**Comment by Benjamin-Loison** [comment]
```python
sniff(prn = packet_callback, iface = 'lo', count = 10)
```
<details>
<summary>Output:</summary>

```
Ether / IP / TCP 127.0.0.1:53654 > 127.0.0.1:mysql S
Ether / IP / TCP 127.0.0.1:53654 > 127.0.0.1:mysql S
Ether / IP / TCP 127.0.0.1:mysql > 127.0.0.1:53654 SA
Ether / IP / TCP 127.0.0.1:mysql > 127.0.0.1:53654 SA
Ether / IP / TCP 127.0.0.1:53654 > 127.0.0.1:mysql A
Ether / IP / TCP 127.0.0.1:53654 > 127.0.0.1:mysql A
Ether / IP / TCP 127.0.0.1:mysql > 127.0.0.1:53654 PA / Raw
Ether / IP / TCP 127.0.0.1:mysql > 127.0.0.1:53654 PA / Raw
Ether / IP / TCP 127.0.0.1:53654 > 127.0.0.1:mysql A
Ether / IP / TCP 127.0.0.1:53654 > 127.0.0.1:mysql A
```
</details>

**Comment by Benjamin-Loison** [comment]
DuckDuckGo search *scapy filter port*.

**Comment by Benjamin-Loison** [comment]
```python
sniff(prn = packet_callback, iface = 'lo', filter = 'dst port mysql', count = 1)
```
```
Ether / IP / TCP 127.0.0.1:38248 > 127.0.0.1:mysql PA / Raw
```

Source: [the Stack Overflow answer 25049249](https://stackoverflow.com/a/25049249)

also works fine with `3306` instead of `mysql`.

**Comment by Benjamin-Loison** [comment]
```python
help(packet)
```
<details>
<summary>Output:</summary>

```
Help on Ether in module scapy.layers.l2 object:

class Ether(scapy.packet.Packet)
 |  Ether(_pkt, /, *, dst=None, src=None, type=36864)
 |  
 |  Method resolution order:
 |      Ether
 |      scapy.packet.Packet
 |      scapy.base_classes.BasePacket
 |      scapy.base_classes.Gen
 |      typing.Generic
 |      scapy.base_classes._CanvasDumpExtended
 |      builtins.object
 |  
 |  Methods defined here:
 |  
 |  answers(self, other)
 |      DEV: true if self is an answer from other
 |  
 |  hashret(self)
 |      DEV: returns a string that has the same value for a request
 |      and its answer.
 |  
 |  mysummary(self)
 |      DEV: can be overloaded to return a string that summarizes the layer.
 |      Only one mysummary() is used in a whole packet summary: the one of the upper layer,  # noqa: E501
 |      except if a mysummary() also returns (as a couple) a list of layers whose  # noqa: E501
 |      mysummary() must be called if they are present.
 |  
 |  ----------------------------------------------------------------------
 |  Class methods defined here:
 |  
 |  dispatch_hook(_pkt=None, *args, **kargs) from scapy.base_classes.Packet_metaclass
 |  
 |  ----------------------------------------------------------------------
 |  Data and other attributes defined here:
 |  
 |  __all_slots__ = {'_answered', '_defrag_pos', '_pkt', 'comment', 'defau...
 |  
 |  __parameters__ = ()
 |  
 |  __signature__ = <Signature (_pkt, /, *, dst=None, src=None, type=36864...
 |  
 |  aliastypes = [<class 'scapy.layers.l2.Ether'>, <class 'scapy.packet.Pa...
 |  
 |  fields_desc = [<DestMACField (Ether).dst>, <SourceMACField (Ether).src...
 |  
 |  payload_guess = [({'type': 122}, <class 'scapy.layers.l2.LLC'>), ({'ty...
 |  
 |  ----------------------------------------------------------------------
 |  Methods inherited from scapy.packet.Packet:
 |  
 |  __bool__ = __nonzero__(self)
 |  
 |  __bytes__(self)
 |  
 |  __contains__(self, cls)
 |      "cls in self" returns true if self has a layer which is an
 |      instance of cls.
 |  
 |  __deepcopy__(self, memo)
 |      Used by copy.deepcopy
 |  
 |  __delattr__(self, attr)
 |      Implement delattr(self, name).
 |  
 |  __delitem__(self, cls)
 |  
 |  __dir__(self)
 |      Add fields to tab completion list.
 |  
 |  __div__(self, other)
 |  
 |  __eq__(self, other)
 |      Return self==value.
 |  
 |  __getattr__(self, attr)
 |  
 |  __getitem__(self, cls)
 |  
 |  __gt__(self, other)
 |      True if other is an answer from self (self ==> other).
 |  
 |  __init__(self, _pkt=b'', post_transform=None, _internal=0, _underlayer=None, _parent=None, stop_dissection_after=None, **fields)
 |      Initialize self.  See help(type(self)) for accurate signature.
 |  
 |  __iter__(self)
 |      Iterates through all sub-packets generated by this Packet.
 |  
 |  __len__(self)
 |  
 |  __lt__(self, other)
 |      True if self is an answer from other (other ==> self).
 |  
 |  __mul__(self, other)
 |  
 |  __ne__(self, other)
 |      Return self!=value.
 |  
 |  __nonzero__(self)
 |  
 |  __rdiv__(self, other)
 |  
 |  __reduce__(self)
 |      Used by pickling methods
 |  
 |  __repr__(self)
 |      Return repr(self).
 |  
 |  __rmul__(self, other)
 |  
 |  __rtruediv__ = __rdiv__(self, other)
 |  
 |  __setattr__(self, attr, val)
 |      Implement setattr(self, name, value).
 |  
 |  __setitem__(self, cls, val)
 |  
 |  __setstate__(self, state)
 |      Rebuild state using pickable methods
 |  
 |  __str__(self)
 |      Return str(self).
 |  
 |  __truediv__ = __div__(self, other)
 |  
 |  add_parent(self, parent)
 |      Set packet parent.
 |      When packet is an element in PacketListField, parent field would
 |      point to the list owner packet.
 |  
 |  add_payload(self, payload)
 |  
 |  add_underlayer(self, underlayer)
 |  
 |  build(self)
 |      Create the current layer
 |      
 |      :return: string of the packet with the payload
 |  
 |  build_done(self, p)
 |  
 |  build_padding(self)
 |  
 |  build_ps(self, internal=0)
 |  
 |  canvas_dump(self, layer_shift=0, rebuild=1)
 |  
 |  clear_cache(self)
 |      Clear the raw packet cache for the field and all its subfields
 |  
 |  clone_with(self, payload=None, **kargs)
 |  
 |  command(self)
 |      Returns a string representing the command you have to type to
 |      obtain the same packet
 |  
 |  copy(self) -> Self
 |      Returns a deep copy of the instance.
 |  
 |  copy_field_value(self, fieldname, value)
 |  
 |  copy_fields_dict(self, fields)
 |  
 |  decode_payload_as(self, cls)
 |      Reassembles the payload and decode it using another packet class
 |  
 |  default_payload_class(self, payload)
 |      DEV: Returns the default payload class if nothing has been found by the
 |      guess_payload_class() method.
 |      
 |      :param str payload: the layer's payload
 |      :return: the default payload class define inside the configuration file
 |  
 |  delfieldval(self, attr)
 |  
 |  display(self, *args, **kargs)
 |      Deprecated. Use show() method.
 |  
 |  dissect(self, s)
 |  
 |  dissection_done(self, pkt)
 |      DEV: will be called after a dissection is completed
 |  
 |  do_build(self)
 |      Create the default version of the layer
 |      
 |      :return: a string of the packet with the payload
 |  
 |  do_build_payload(self)
 |      Create the default version of the payload layer
 |      
 |      :return: a string of payload layer
 |  
 |  do_build_ps(self)
 |  
 |  do_dissect(self, s)
 |  
 |  do_dissect_payload(self, s)
 |      Perform the dissection of the layer's payload
 |      
 |      :param str s: the raw layer
 |  
 |  do_init_cached_fields(self, for_dissect_only=False)
 |      Initialize each fields of the fields_desc dict, or use the cached
 |      fields information
 |  
 |  do_init_fields(self, flist)
 |      Initialize each fields of the fields_desc dict
 |  
 |  extract_padding(self, s)
 |      DEV: to be overloaded to extract current layer's padding.
 |      
 |      :param str s: the current layer
 |      :return: a couple of strings (actual layer, padding)
 |  
 |  firstlayer(self)
 |  
 |  fragment(self, *args, **kargs)
 |  
 |  get_field(self, fld)
 |      DEV: returns the field instance from the name of the field
 |  
 |  getfield_and_val(self, attr)
 |  
 |  getfieldval(self, attr)
 |  
 |  getlayer(self, cls, nb=1, _track=None, _subclass=None, **flt)
 |      Return the nb^th layer that is an instance of cls, matching flt
 |      values.
 |  
 |  guess_payload_class(self, payload)
 |      DEV: Guesses the next payload class from layer bonds.
 |      Can be overloaded to use a different mechanism.
 |      
 |      :param str payload: the layer's payload
 |      :return: the payload class
 |  
 |  haslayer(self, cls, _subclass=None)
 |      true if self has a layer that is an instance of cls.
 |      Superseded by "cls in self" syntax.
 |  
 |  hide_defaults(self)
 |      Removes fields' values that are the same as default values.
 |  
 |  init_fields(self, for_dissect_only=False)
 |      Initialize each fields of the fields_desc dict
 |  
 |  iterpayloads(self)
 |      Used to iter through the payloads of a Packet.
 |      Useful for DNS or 802.11 for instance.
 |  
 |  json(self)
 |      Returns a JSON representing the packet.
 |      
 |      Please note that this cannot be used for bijective usage: data loss WILL occur,
 |      so it will not make sense to try to rebuild the packet from the output.
 |      This must only be used for a grepping/displaying purpose.
 |  
 |  lastlayer(self, layer=None)
 |      Returns the uppest layer of the packet
 |  
 |  layers(self)
 |      returns a list of layer classes (including subclasses) in this packet
 |  
 |  post_build(self, pkt, pay)
 |      DEV: called right after the current layer is build.
 |      
 |      :param str pkt: the current packet (build by self_build function)
 |      :param str pay: the packet payload (build by do_build_payload function)
 |      :return: a string of the packet with the payload
 |  
 |  post_dissect(self, s)
 |      DEV: is called right after the current layer has been dissected
 |  
 |  post_dissection(self, pkt)
 |      DEV: is called after the dissection of the whole packet
 |  
 |  pre_dissect(self, s)
 |      DEV: is called right before the current layer is dissected
 |  
 |  prepare_cached_fields(self, flist)
 |      Prepare the cached fields of the fields_desc dict
 |  
 |  remove_parent(self, other)
 |      Remove packet parent.
 |      When packet is an element in PacketListField, parent field would
 |      point to the list owner packet.
 |  
 |  remove_payload(self)
 |  
 |  remove_underlayer(self, other)
 |  
 |  route(self)
 |  
 |  self_build(self)
 |      Create the default layer regarding fields_desc dict
 |      
 |      :param field_pos_list:
 |  
 |  setfieldval(self, attr, val)
 |  
 |  show(self, dump=False, indent=3, lvl='', label_lvl='')
 |      Prints or returns (when "dump" is true) a hierarchical view of the
 |      packet.
 |      
 |      :param dump: determine if it prints or returns the string value
 |      :param int indent: the size of indentation for each layer
 |      :param str lvl: additional information about the layer lvl
 |      :param str label_lvl: additional information about the layer fields
 |      :return: return a hierarchical view if dump, else print it
 |  
 |  show2(self, dump=False, indent=3, lvl='', label_lvl='')
 |      Prints or returns (when "dump" is true) a hierarchical view of an
 |      assembled version of the packet, so that automatic fields are
 |      calculated (checksums, etc.)
 |      
 |      :param dump: determine if it prints or returns the string value
 |      :param int indent: the size of indentation for each layer
 |      :param str lvl: additional information about the layer lvl
 |      :param str label_lvl: additional information about the layer fields
 |      :return: return a hierarchical view if dump, else print it
 |  
 |  sprintf(self, fmt, relax=1)
 |      sprintf(format, [relax=1]) -> str
 |      
 |      Where format is a string that can include directives. A directive
 |      begins and ends by % and has the following format:
 |      ``%[fmt[r],][cls[:nb].]field%``
 |      
 |      :param fmt: is a classic printf directive, "r" can be appended for raw
 |        substitution:
 |        (ex: IP.flags=0x18 instead of SA), nb is the number of the layer
 |        (ex: for IP/IP packets, IP:2.src is the src of the upper IP layer).
 |        Special case : "%.time%" is the creation time.
 |        Ex::
 |      
 |          p.sprintf(
 |            "%.time% %-15s,IP.src% -> %-15s,IP.dst% %IP.chksum% "
 |            "%03xr,IP.proto% %r,TCP.flags%"
 |          )
 |      
 |        Moreover, the format string can include conditional statements. A
 |        conditional statement looks like : {layer:string} where layer is a
 |        layer name, and string is the string to insert in place of the
 |        condition if it is true, i.e. if layer is present. If layer is
 |        preceded by a "!", the result is inverted. Conditions can be
 |        imbricated. A valid statement can be::
 |      
 |          p.sprintf("This is a{TCP: TCP}{UDP: UDP}{ICMP:n ICMP} packet")
 |          p.sprintf("{IP:%IP.dst% {ICMP:%ICMP.type%}{TCP:%TCP.dport%}}")
 |      
 |        A side effect is that, to obtain "{" and "}" characters, you must use
 |        "%(" and "%)".
 |  
 |  summary(self, intern=0)
 |      Prints a one line summary of a packet.
 |  
 |  ----------------------------------------------------------------------
 |  Class methods inherited from scapy.packet.Packet:
 |  
 |  from_hexcap() from scapy.base_classes.Packet_metaclass
 |  
 |  lower_bonds() from scapy.base_classes.Packet_metaclass
 |  
 |  upper_bonds() from scapy.base_classes.Packet_metaclass
 |  
 |  ----------------------------------------------------------------------
 |  Data descriptors inherited from scapy.packet.Packet:
 |  
 |  __dict__
 |      dictionary for instance variables (if defined)
 |  
 |  __weakref__
 |      list of weak references to the object (if defined)
 |  
 |  comment
 |  
 |  default_fields
 |  
 |  direction
 |  
 |  explicit
 |  
 |  fields
 |  
 |  fieldtype
 |  
 |  name
 |  
 |  original
 |  
 |  overload_fields
 |  
 |  overloaded_fields
 |  
 |  packetfields
 |  
 |  parent
 |  
 |  payload
 |  
 |  post_transforms
 |  
 |  process_information
 |  
 |  raw_packet_cache
 |  
 |  raw_packet_cache_fields
 |  
 |  sent_time
 |  
 |  sniffed_on
 |  
 |  stop_dissection_after
 |  
 |  time
 |  
 |  underlayer
 |  
 |  wirelen
 |  
 |  ----------------------------------------------------------------------
 |  Data and other attributes inherited from scapy.packet.Packet:
 |  
 |  __hash__ = None
 |  
 |  class_default_fields = {<class 'scapy.arch.linux.rtnetlink.rtmsghdr'>:...
 |  
 |  class_default_fields_ref = {<class 'scapy.arch.linux.rtnetlink.rtmsghd...
 |  
 |  class_dont_cache = {<class 'scapy.layers.ntlm.AV_PAIR'>: True, <class ...
 |  
 |  class_fieldtype = {<class 'scapy.arch.linux.rtnetlink.rtmsghdr'>: {'nl...
 |  
 |  class_packetfields = {<class 'scapy.arch.linux.rtnetlink.rtmsghdr'>: [...
 |  
 |  deprecated_fields = {}
 |  
 |  match_subclass = False
 |  
 |  show_indent = 1
 |  
 |  show_summary = True
 |  
 |  ----------------------------------------------------------------------
 |  Data and other attributes inherited from scapy.base_classes.BasePacket:
 |  
 |  __orig_bases__ = (scapy.base_classes.Gen[ForwardRef('Packet')],)
 |  
 |  ----------------------------------------------------------------------
 |  Methods inherited from scapy.base_classes.Gen:
 |  
 |  __iterlen__(self)
 |  
 |  ----------------------------------------------------------------------
 |  Class methods inherited from typing.Generic:
 |  
 |  __class_getitem__(params) from scapy.base_classes.Packet_metaclass
 |      Parameterizes a generic class.
 |      
 |      At least, parameterizing a generic class is the *main* thing this method
 |      does. For example, for some generic class `Foo`, this is called when we
 |      do `Foo[int]` - there, with `cls=Foo` and `params=int`.
 |      
 |      However, note that this method is also called when defining generic
 |      classes in the first place with `class Foo(Generic[T]): ...`.
 |  
 |  __init_subclass__(*args, **kwargs) from scapy.base_classes.Packet_metaclass
 |      This method is called when a class is subclassed.
 |      
 |      The default implementation does nothing. It may be
 |      overridden to extend subclasses.
 |  
 |  ----------------------------------------------------------------------
 |  Methods inherited from scapy.base_classes._CanvasDumpExtended:
 |  
 |  pdfdump(self, filename=None, **kargs)
 |      pdfdump(filename=None, layer_shift=0, rebuild=1)
 |      
 |      Creates a PDF file describing a packet. If filename is not provided a
 |      temporary file is created and xpdf is called.
 |      
 |      :param filename: the file's filename
 |  
 |  psdump(self, filename=None, **kargs)
 |      psdump(filename=None, layer_shift=0, rebuild=1)
 |      
 |      Creates an EPS file describing a packet. If filename is not provided a
 |      temporary file is created and gs is called.
 |      
 |      :param filename: the file's filename
 |  
 |  svgdump(self, filename=None, **kargs)
 |      svgdump(filename=None, layer_shift=0, rebuild=1)
 |      
 |      Creates an SVG file describing a packet. If filename is not provided a
 |      temporary file is created and gs is called.
 |      
 |      :param filename: the file's filename
```
</details>

```python
print(json.dumps(json.loads(packet.json()), indent = 4))
```
<details>
<summary>Output:</summary>

```json
{
    "dst": "00:00:00:00:00:00",
    "src": "00:00:00:00:00:00",
    "type": 2048,
    "payload": {
        "version": 4,
        "ihl": 5,
        "tos": 0,
        "len": 256,
        "id": 50114,
        "flags": 2,
        "frag": 0,
        "ttl": 64,
        "proto": 6,
        "chksum": 30771,
        "src": "127.0.0.1",
        "dst": "127.0.0.1",
        "payload": {
            "sport": 49354,
            "dport": 3306,
            "seq": 1284227313,
            "ack": 4210015691,
            "dataofs": 8,
            "reserved": 0,
            "flags": 24,
            "window": 9207,
            "chksum": 65268,
            "urgptr": 0,
            "options": [
                "('NOP', None)",
                "('NOP', None)",
                "('Timestamp', (2162314602, 2162313896))"
            ],
            "payload": {
                "load": "\\xc8\u0000\u0000\u0000\u0016SELECT user_id, sum(case when status= ? then 1 else 0 end) AS count FROM notification WHERE user_id IN (SELECT user_id FROM notification WHERE updated_unix >= ? AND updated_unix < ?) GROUP BY user_id"
            }
        }
    }
}
```
</details>

```python
packet.json()
```

is a string not pretty print.

**Comment by Benjamin-Loison** [comment]
Considering `help` `load` occurrences.

```python
print(packet.payload_guess)
```
<details>
<summary>Output:</summary>

```
[({'type': 122}, <class 'scapy.layers.l2.LLC'>), ({'type': 34928}, <class 'scapy.layers.l2.LLC'>), ({'type': 33024}, <class 'scapy.layers.l2.Dot1Q'>), ({'type': 34984}, <class 'scapy.layers.l2.Dot1AD'>), ({'type': 35047}, <class 'scapy.layers.l2.Dot1AH'>), ({'type': 1}, <class 'scapy.layers.l2.Ether'>), ({'type': 2054}, <class 'scapy.layers.l2.ARP'>), ({'type': 34980}, <class 'scapy.contrib.ethercat.EtherCat'>), ({'type': 2048}, <class 'scapy.layers.inet.IP'>), ({'type': 34525}, <class 'scapy.layers.inet6.IPv6'>), ({'type': 34958}, <class 'scapy.layers.eap.EAPOL'>), ({'type': 34915}, <class 'scapy.layers.ppp.PPPoED'>), ({'type': 34916}, <class 'scapy.layers.ppp.PPPoE'>), ({'type': 32801}, <class 'scapy.layers.ppp.PPP_IPCP'>), ({'type': 32851}, <class 'scapy.layers.ppp.PPP_ECP'>), ({'type': 35033}, <class 'scapy.layers.lltd.LLTD'>), ({'type': 41197}, <class 'scapy.layers.sixlowpan.SixLoWPAN'>)]
```
</details>

does not seem useful.

**Comment by Benjamin-Loison** [comment]
<details>
<summary>Output:</summary>

```
 |  build(self)
 |      Create the current layer
 |      
 |      :return: string of the packet with the payload
...
 |  decode_payload_as(self, cls)
 |      Reassembles the payload and decode it using another packet class
 |  
 |  default_payload_class(self, payload)
 |      DEV: Returns the default payload class if nothing has been found by the
 |      guess_payload_class() method.
 |      
 |      :param str payload: the layer's payload
 |      :return: the default payload class define inside the configuration file
...
 |  do_build(self)
 |      Create the default version of the layer
 |      
 |      :return: a string of the packet with the payload
 |  
 |  do_build_payload(self)
 |      Create the default version of the payload layer
 |      
 |      :return: a string of payload layer
...
 |  do_dissect_payload(self, s)
 |      Perform the dissection of the layer's payload
...
 |  guess_payload_class(self, payload)
 |      DEV: Guesses the next payload class from layer bonds.
 |      Can be overloaded to use a different mechanism.
 |      
 |      :param str payload: the layer's payload
 |      :return: the payload class
...
 |  iterpayloads(self)
 |      Used to iter through the payloads of a Packet.
 |      Useful for DNS or 802.11 for instance.
...
 |  post_build(self, pkt, pay)
 |      DEV: called right after the current layer is build.
 |      
 |      :param str pkt: the current packet (build by self_build function)
 |      :param str pay: the packet payload (build by do_build_payload function)
 |      :return: a string of the packet with the payload
```
</details>

do not seem clearly useful.

Just extracting from the JSON may not be optimized.

**Comment by Benjamin-Loison** [comment]
```python
type(packet.payload)
packet.payload
```
```
<class 'scapy.layers.inet.IP'>
IP / TCP 127.0.0.1:35922 > 127.0.0.1:mysql PA / Raw
```

Note that I paid attention in my test that the JSON contains an SQL query.

**Comment by Benjamin-Loison** [comment]
```python
help(packet.payload)
```
<details>
<summary>Output:</summary>

```
Help on IP in module scapy.layers.inet object:

class IP(scapy.packet.Packet, IPTools)
 |  IP(_pkt, /, *, version=4, ihl=None, tos=0, len=None, id=1, flags=<Flag 0 ()>, frag=0, ttl=64, proto=0, chksum=None, src=None, dst=None, options=[])
 |  
 |  Method resolution order:
 |      IP
 |      scapy.packet.Packet
 |      scapy.base_classes.BasePacket
 |      scapy.base_classes.Gen
 |      typing.Generic
 |      scapy.base_classes._CanvasDumpExtended
 |      IPTools
 |      builtins.object
 |  
 |  Methods defined here:
 |  
 |  answers(self, other)
 |      DEV: true if self is an answer from other
 |  
 |  extract_padding(self, s)
 |      DEV: to be overloaded to extract current layer's padding.
 |      
 |      :param str s: the current layer
 |      :return: a couple of strings (actual layer, padding)
 |  
 |  fragment(self, fragsize=1480)
 |      Fragment IP datagrams
 |  
 |  hashret(self)
 |      DEV: returns a string that has the same value for a request
 |      and its answer.
 |  
 |  mysummary(self)
 |      DEV: can be overloaded to return a string that summarizes the layer.
 |      Only one mysummary() is used in a whole packet summary: the one of the upper layer,  # noqa: E501
 |      except if a mysummary() also returns (as a couple) a list of layers whose  # noqa: E501
 |      mysummary() must be called if they are present.
 |  
 |  post_build(self, p, pay)
 |      DEV: called right after the current layer is build.
 |      
 |      :param str pkt: the current packet (build by self_build function)
 |      :param str pay: the packet payload (build by do_build_payload function)
 |      :return: a string of the packet with the payload
 |  
 |  route(self)
 |  
 |  ----------------------------------------------------------------------
 |  Data and other attributes defined here:
 |  
 |  __all_slots__ = {'_answered', '_pkt', 'comment', 'default_fields', 'di...
 |  
 |  __parameters__ = ()
 |  
 |  __signature__ = <Signature (_pkt, /, *, version=4, ihl=None, tos...=0,...
 |  
 |  aliastypes = [<class 'scapy.layers.inet.IP'>, <class 'scapy.packet.Pac...
 |  
 |  fields_desc = [<BitField (IP,IPerror,IPv46).version>, <BitField (IP,IP...
 |  
 |  payload_guess = [({'frag': 0, 'proto': 4}, <class 'scapy.layers.inet.I...
 |  
 |  ----------------------------------------------------------------------
 |  Methods inherited from scapy.packet.Packet:
 |  
 |  __bool__ = __nonzero__(self)
 |  
 |  __bytes__(self)
 |  
 |  __contains__(self, cls)
 |      "cls in self" returns true if self has a layer which is an
 |      instance of cls.
 |  
 |  __deepcopy__(self, memo)
 |      Used by copy.deepcopy
 |  
 |  __delattr__(self, attr)
 |      Implement delattr(self, name).
 |  
 |  __delitem__(self, cls)
 |  
 |  __dir__(self)
 |      Add fields to tab completion list.
 |  
 |  __div__(self, other)
 |  
 |  __eq__(self, other)
 |      Return self==value.
 |  
 |  __getattr__(self, attr)
 |  
 |  __getitem__(self, cls)
 |  
 |  __gt__(self, other)
 |      True if other is an answer from self (self ==> other).
 |  
 |  __init__(self, _pkt=b'', post_transform=None, _internal=0, _underlayer=None, _parent=None, stop_dissection_after=None, **fields)
 |      Initialize self.  See help(type(self)) for accurate signature.
 |  
 |  __iter__(self)
 |      Iterates through all sub-packets generated by this Packet.
 |  
 |  __len__(self)
 |  
 |  __lt__(self, other)
 |      True if self is an answer from other (other ==> self).
 |  
 |  __mul__(self, other)
 |  
 |  __ne__(self, other)
 |      Return self!=value.
 |  
 |  __nonzero__(self)
 |  
 |  __rdiv__(self, other)
 |  
 |  __reduce__(self)
 |      Used by pickling methods
 |  
 |  __repr__(self)
 |      Return repr(self).
 |  
 |  __rmul__(self, other)
 |  
 |  __rtruediv__ = __rdiv__(self, other)
 |  
 |  __setattr__(self, attr, val)
 |      Implement setattr(self, name, value).
 |  
 |  __setitem__(self, cls, val)
 |  
 |  __setstate__(self, state)
 |      Rebuild state using pickable methods
 |  
 |  __str__(self)
 |      Return str(self).
 |  
 |  __truediv__ = __div__(self, other)
 |  
 |  add_parent(self, parent)
 |      Set packet parent.
 |      When packet is an element in PacketListField, parent field would
 |      point to the list owner packet.
 |  
 |  add_payload(self, payload)
 |  
 |  add_underlayer(self, underlayer)
 |  
 |  build(self)
 |      Create the current layer
 |      
 |      :return: string of the packet with the payload
 |  
 |  build_done(self, p)
 |  
 |  build_padding(self)
 |  
 |  build_ps(self, internal=0)
 |  
 |  canvas_dump(self, layer_shift=0, rebuild=1)
 |  
 |  clear_cache(self)
 |      Clear the raw packet cache for the field and all its subfields
 |  
 |  clone_with(self, payload=None, **kargs)
 |  
 |  command(self)
 |      Returns a string representing the command you have to type to
 |      obtain the same packet
 |  
 |  copy(self) -> Self
 |      Returns a deep copy of the instance.
 |  
 |  copy_field_value(self, fieldname, value)
 |  
 |  copy_fields_dict(self, fields)
 |  
 |  decode_payload_as(self, cls)
 |      Reassembles the payload and decode it using another packet class
 |  
 |  default_payload_class(self, payload)
 |      DEV: Returns the default payload class if nothing has been found by the
 |      guess_payload_class() method.
 |      
 |      :param str payload: the layer's payload
 |      :return: the default payload class define inside the configuration file
 |  
 |  delfieldval(self, attr)
 |  
 |  display(self, *args, **kargs)
 |      Deprecated. Use show() method.
 |  
 |  dissect(self, s)
 |  
 |  dissection_done(self, pkt)
 |      DEV: will be called after a dissection is completed
 |  
 |  do_build(self)
 |      Create the default version of the layer
 |      
 |      :return: a string of the packet with the payload
 |  
 |  do_build_payload(self)
 |      Create the default version of the payload layer
 |      
 |      :return: a string of payload layer
 |  
 |  do_build_ps(self)
 |  
 |  do_dissect(self, s)
 |  
 |  do_dissect_payload(self, s)
 |      Perform the dissection of the layer's payload
 |      
 |      :param str s: the raw layer
 |  
 |  do_init_cached_fields(self, for_dissect_only=False)
 |      Initialize each fields of the fields_desc dict, or use the cached
 |      fields information
 |  
 |  do_init_fields(self, flist)
 |      Initialize each fields of the fields_desc dict
 |  
 |  firstlayer(self)
 |  
 |  get_field(self, fld)
 |      DEV: returns the field instance from the name of the field
 |  
 |  getfield_and_val(self, attr)
 |  
 |  getfieldval(self, attr)
 |  
 |  getlayer(self, cls, nb=1, _track=None, _subclass=None, **flt)
 |      Return the nb^th layer that is an instance of cls, matching flt
 |      values.
 |  
 |  guess_payload_class(self, payload)
 |      DEV: Guesses the next payload class from layer bonds.
 |      Can be overloaded to use a different mechanism.
 |      
 |      :param str payload: the layer's payload
 |      :return: the payload class
 |  
 |  haslayer(self, cls, _subclass=None)
 |      true if self has a layer that is an instance of cls.
 |      Superseded by "cls in self" syntax.
 |  
 |  hide_defaults(self)
 |      Removes fields' values that are the same as default values.
 |  
 |  init_fields(self, for_dissect_only=False)
 |      Initialize each fields of the fields_desc dict
 |  
 |  iterpayloads(self)
 |      Used to iter through the payloads of a Packet.
 |      Useful for DNS or 802.11 for instance.
 |  
 |  json(self)
 |      Returns a JSON representing the packet.
 |      
 |      Please note that this cannot be used for bijective usage: data loss WILL occur,
 |      so it will not make sense to try to rebuild the packet from the output.
 |      This must only be used for a grepping/displaying purpose.
 |  
 |  lastlayer(self, layer=None)
 |      Returns the uppest layer of the packet
 |  
 |  layers(self)
 |      returns a list of layer classes (including subclasses) in this packet
 |  
 |  post_dissect(self, s)
 |      DEV: is called right after the current layer has been dissected
 |  
 |  post_dissection(self, pkt)
 |      DEV: is called after the dissection of the whole packet
 |  
 |  pre_dissect(self, s)
 |      DEV: is called right before the current layer is dissected
 |  
 |  prepare_cached_fields(self, flist)
 |      Prepare the cached fields of the fields_desc dict
 |  
 |  remove_parent(self, other)
 |      Remove packet parent.
 |      When packet is an element in PacketListField, parent field would
 |      point to the list owner packet.
 |  
 |  remove_payload(self)
 |  
 |  remove_underlayer(self, other)
 |  
 |  self_build(self)
 |      Create the default layer regarding fields_desc dict
 |      
 |      :param field_pos_list:
 |  
 |  setfieldval(self, attr, val)
 |  
 |  show(self, dump=False, indent=3, lvl='', label_lvl='')
 |      Prints or returns (when "dump" is true) a hierarchical view of the
 |      packet.
 |      
 |      :param dump: determine if it prints or returns the string value
 |      :param int indent: the size of indentation for each layer
 |      :param str lvl: additional information about the layer lvl
 |      :param str label_lvl: additional information about the layer fields
 |      :return: return a hierarchical view if dump, else print it
 |  
 |  show2(self, dump=False, indent=3, lvl='', label_lvl='')
 |      Prints or returns (when "dump" is true) a hierarchical view of an
 |      assembled version of the packet, so that automatic fields are
 |      calculated (checksums, etc.)
 |      
 |      :param dump: determine if it prints or returns the string value
 |      :param int indent: the size of indentation for each layer
 |      :param str lvl: additional information about the layer lvl
 |      :param str label_lvl: additional information about the layer fields
 |      :return: return a hierarchical view if dump, else print it
 |  
 |  sprintf(self, fmt, relax=1)
 |      sprintf(format, [relax=1]) -> str
 |      
 |      Where format is a string that can include directives. A directive
 |      begins and ends by % and has the following format:
 |      ``%[fmt[r],][cls[:nb].]field%``
 |      
 |      :param fmt: is a classic printf directive, "r" can be appended for raw
 |        substitution:
 |        (ex: IP.flags=0x18 instead of SA), nb is the number of the layer
 |        (ex: for IP/IP packets, IP:2.src is the src of the upper IP layer).
 |        Special case : "%.time%" is the creation time.
 |        Ex::
 |      
 |          p.sprintf(
 |            "%.time% %-15s,IP.src% -> %-15s,IP.dst% %IP.chksum% "
 |            "%03xr,IP.proto% %r,TCP.flags%"
 |          )
 |      
 |        Moreover, the format string can include conditional statements. A
 |        conditional statement looks like : {layer:string} where layer is a
 |        layer name, and string is the string to insert in place of the
 |        condition if it is true, i.e. if layer is present. If layer is
 |        preceded by a "!", the result is inverted. Conditions can be
 |        imbricated. A valid statement can be::
 |      
 |          p.sprintf("This is a{TCP: TCP}{UDP: UDP}{ICMP:n ICMP} packet")
 |          p.sprintf("{IP:%IP.dst% {ICMP:%ICMP.type%}{TCP:%TCP.dport%}}")
 |      
 |        A side effect is that, to obtain "{" and "}" characters, you must use
 |        "%(" and "%)".
 |  
 |  summary(self, intern=0)
 |      Prints a one line summary of a packet.
 |  
 |  ----------------------------------------------------------------------
 |  Class methods inherited from scapy.packet.Packet:
 |  
 |  from_hexcap() from scapy.base_classes.Packet_metaclass
 |  
 |  lower_bonds() from scapy.base_classes.Packet_metaclass
 |  
 |  upper_bonds() from scapy.base_classes.Packet_metaclass
 |  
 |  ----------------------------------------------------------------------
 |  Data descriptors inherited from scapy.packet.Packet:
 |  
 |  __dict__
 |      dictionary for instance variables (if defined)
 |  
 |  __weakref__
 |      list of weak references to the object (if defined)
 |  
 |  comment
 |  
 |  default_fields
 |  
 |  direction
 |  
 |  explicit
 |  
 |  fields
 |  
 |  fieldtype
 |  
 |  name
 |  
 |  original
 |  
 |  overload_fields
 |  
 |  overloaded_fields
 |  
 |  packetfields
 |  
 |  parent
 |  
 |  payload
 |  
 |  post_transforms
 |  
 |  process_information
 |  
 |  raw_packet_cache
 |  
 |  raw_packet_cache_fields
 |  
 |  sent_time
 |  
 |  sniffed_on
 |  
 |  stop_dissection_after
 |  
 |  time
 |  
 |  underlayer
 |  
 |  wirelen
 |  
 |  ----------------------------------------------------------------------
 |  Data and other attributes inherited from scapy.packet.Packet:
 |  
 |  __hash__ = None
 |  
 |  class_default_fields = {<class 'scapy.arch.linux.rtnetlink.rtmsghdr'>:...
 |  
 |  class_default_fields_ref = {<class 'scapy.arch.linux.rtnetlink.rtmsghd...
 |  
 |  class_dont_cache = {<class 'scapy.layers.ntlm.AV_PAIR'>: True, <class ...
 |  
 |  class_fieldtype = {<class 'scapy.arch.linux.rtnetlink.rtmsghdr'>: {'nl...
 |  
 |  class_packetfields = {<class 'scapy.arch.linux.rtnetlink.rtmsghdr'>: [...
 |  
 |  deprecated_fields = {}
 |  
 |  match_subclass = False
 |  
 |  show_indent = 1
 |  
 |  show_summary = True
 |  
 |  ----------------------------------------------------------------------
 |  Data and other attributes inherited from scapy.base_classes.BasePacket:
 |  
 |  __orig_bases__ = (scapy.base_classes.Gen[ForwardRef('Packet')],)
 |  
 |  ----------------------------------------------------------------------
 |  Methods inherited from scapy.base_classes.Gen:
 |  
 |  __iterlen__(self)
 |  
 |  ----------------------------------------------------------------------
 |  Class methods inherited from typing.Generic:
 |  
 |  __class_getitem__(params) from scapy.base_classes.Packet_metaclass
 |      Parameterizes a generic class.
 |      
 |      At least, parameterizing a generic class is the *main* thing this method
 |      does. For example, for some generic class `Foo`, this is called when we
 |      do `Foo[int]` - there, with `cls=Foo` and `params=int`.
 |      
 |      However, note that this method is also called when defining generic
 |      classes in the first place with `class Foo(Generic[T]): ...`.
 |  
 |  __init_subclass__(*args, **kwargs) from scapy.base_classes.Packet_metaclass
 |      This method is called when a class is subclassed.
 |      
 |      The default implementation does nothing. It may be
 |      overridden to extend subclasses.
 |  
 |  ----------------------------------------------------------------------
 |  Methods inherited from scapy.base_classes._CanvasDumpExtended:
 |  
 |  pdfdump(self, filename=None, **kargs)
 |      pdfdump(filename=None, layer_shift=0, rebuild=1)
 |      
 |      Creates a PDF file describing a packet. If filename is not provided a
 |      temporary file is created and xpdf is called.
 |      
 |      :param filename: the file's filename
 |  
 |  psdump(self, filename=None, **kargs)
 |      psdump(filename=None, layer_shift=0, rebuild=1)
 |      
 |      Creates an EPS file describing a packet. If filename is not provided a
 |      temporary file is created and gs is called.
 |      
 |      :param filename: the file's filename
 |  
 |  svgdump(self, filename=None, **kargs)
 |      svgdump(filename=None, layer_shift=0, rebuild=1)
 |      
 |      Creates an SVG file describing a packet. If filename is not provided a
 |      temporary file is created and gs is called.
 |      
 |      :param filename: the file's filename
 |  
 |  ----------------------------------------------------------------------
 |  Methods inherited from IPTools:
 |  
 |  hops(self)
 |  
 |  ottl(self)
 |  
 |  whois(self)
 |      whois the source and print the output
```
</details>

**Comment by Benjamin-Loison** [comment]
```python
type(packet.payload.payload)
```
```
<class 'scapy.layers.inet.TCP'>
```

**Comment by Benjamin-Loison** [comment]
DuckDuckGo search *scapy get packet payload*.

**Comment by Benjamin-Loison** [comment]
```python
packet.load
```
```
b'\x12\x03\x00\x00\x16SELECT `id`, `lower_name`, `name`, `full_name`, `email`, `keep_email_private`, `email_notifications_preference`, `passwd`, `passwd_hash_algo`, `must_change_password`, `login_type`, `login_source`, `login_name`, `type`, `location`, `website`, `rands`, `salt`, `language`, `description`, `created_unix`, `updated_unix`, `last_login_unix`, `last_repo_visibility`, `max_repo_creation`, `is_active`, `is_admin`, `is_restricted`, `allow_git_hook`, `allow_import_local`, `allow_create_organization`, `prohibit_login`, `avatar`, `avatar_email`, `use_custom_avatar`, `num_followers`, `num_following`, `num_stars`, `num_repos`, `num_teams`, `num_members`, `visibility`, `repo_admin_change_team_access`, `diff_view_style`, `theme`, `keep_activity_private` FROM `user` WHERE `lower_name`=? LIMIT 1'
```

Source: [the Stack Overflow question 61357218](https://stackoverflow.com/q/61357218)

note that this is assuming no unauthenticated packets to this port.

```
b'\xc8\x00\x00\x00\x16SELECT user_id, sum(case when status= ? then 1 else 0 end) AS count FROM notification WHERE user_id IN (SELECT user_id FROM notification WHERE updated_unix >= ? AND updated_unix < ?) GROUP BY user_id'
```

is another example.

**Comment by Benjamin-Loison** [comment]
DuckDuckGo and Google search *scapy SQL* does not seem helpful, notably [Scapy-MySQL-Script](https://github.com/Youssifm/Scapy-MySQL-Script).

**Comment by Benjamin-Loison** [comment]
DuckDuckGo search *Python lstrip binary*.

**Comment by Benjamin-Loison** [comment]
```python
help(''.lstrip)
```
<details>
<summary>Output:</summary>

```
Help on built-in function lstrip:

lstrip(chars=None, /) method of builtins.str instance
    Return a copy of the string with leading whitespace removed.
    
    If chars is given and not None, remove characters in chars instead.
```
</details>

Source: https://labex.io/tutorials/python-how-to-strip-binary-string-prefix-462160

**Comment by Benjamin-Loison** [comment]
```python
b'\xc8\x00\x00\x00\x16SELECT user_id'.decode('ascii')
```
<details>
<summary>Output:</summary>

```
Traceback (most recent call last):
  File "<console>", line 1, in <module>
UnicodeDecodeError: 'ascii' codec can't decode byte 0xc8 in position 0: ordinal not in range(128)
```
</details>

DuckDuckGo and Google search *Python decode as possible*.

**Comment by Benjamin-Loison** [comment]
```python
help(b''.decode)
```
<details>
<summary>Output:</summary>

```
Help on built-in function decode:

decode(encoding='utf-8', errors='strict') method of builtins.bytes instance
    Decode the bytes using the codec registered for encoding.
    
    encoding
      The encoding with which to decode the bytes.
    errors
      The error handling scheme to use for the handling of decoding errors.
      The default is 'strict' meaning that decoding errors raise a
      UnicodeDecodeError. Other possible values are 'ignore' and 'replace'
      as well as any other name registered with codecs.register_error that
      can handle UnicodeDecodeErrors.
```
</details>

**Comment by Benjamin-Loison** [comment]
```python
b'\xc8\x00\x00\x00\x16SELECT user_id'.decode(errors = 'replace')
```
```python
'�\x00\x00\x00\x16SELECT user_id'
```

```python
b'\xc8\x00\x00\x00\x16SELECT user_id'.decode(errors = 'ignore')
```
```python
'\x00\x00\x00\x16SELECT user_id'
```

**Comment by Benjamin-Loison** [comment]
DuckDuckGo search *Python is byte ascii*.

**Comment by Benjamin-Loison** [comment]
<details>
<summary>Python script:</summary>

```python
import string

PACKET_BYTES = b'\xc8\x00\x00\x00\x16SELECT user_id'

PRINTABLE_CHARS = bytes(string.printable, 'ascii')
print(''.join(chr(char) for char in PACKET_BYTES if char in PRINTABLE_CHARS))
```
</details>

```
SELECT user_id
```

Source: [the Stack Overflow answer 42065372](https://stackoverflow.com/a/42065372)

**Comment by Benjamin-Loison** [comment]
<details>
<summary>Python script:</summary>

```python
import string

PACKET_BYTES = b'\xc8\x00\x00\x00\x16SELECT user_id'
PRINTABLE_CHARS = bytes(string.printable, 'ascii')

for charIndex, char in enumerate(PACKET_BYTES):
    if char in PRINTABLE_CHARS:
        print(''.join(chr(char) for char in PACKET_BYTES[charIndex:] if char in PRINTABLE_CHARS))
        break
```
</details>

Note that on Gitea update the SQL query may change or even the table be renamed etc.

**Comment by Benjamin-Loison** [comment]
<details>
<summary>Python script:</summary>

```python
from scapy.all import sniff
import string

PRINTABLE_CHARS = bytes(string.printable, 'ascii')

def packet_callback(packet):
    for charIndex, char in enumerate(packet.load):
        if char in PRINTABLE_CHARS:
            print(''.join(chr(char) for char in packet.load[charIndex:] if char in PRINTABLE_CHARS))
            break

sniff(prn = packet_callback, iface = 'lo', filter = 'dst port mysql', count = 1)
```
</details>

**Comment by Benjamin-Loison** [comment]
Have to pay attention not to remember more than one packet at a time.

**Comment by Benjamin-Loison** [comment]
`count`, `store`, `lfilter` (unclear), `stop_filter` may help.

**Comment by Benjamin-Loison** [comment]
```
WARNING: Socket <scapy.arch.linux.L2ListenSocket object at 0x7f0ce068ab90> failed with 'load'. It was closed.
```

`try` and `except` seems to help.

How to figure out the precise involved exception (if any)?

Note that my binary `lstrip` is not perfect as there are still some printable characters not being SQL as far as I know.

**Comment by Benjamin-Loison** [comment]
It seems that the packets are treated all at once, based on the following Python script, once enough gathered which is quite unwanted in my case but can artificially set `count = 1` but may not be optimized.

```python
from datetime import datetime

print(datetime.now())
```

**Comment by Benjamin-Loison** [comment]
```
WARNING: more Socket <scapy.arch.linux.L2ListenSocket object at 0x7ffa1c75cbd0> failed with 'load'. It was closed.
```

sometimes too.

**Comment by Benjamin-Loison** [comment]
<details>
<summary>Python script:</summary>

```python
from scapy.all import sniff
import re

def packet_callback(packet):
    load = packet.load.decode('ascii', errors = 'ignore')
    #print(load)
    loadMatch = re.fullmatch('.*(INSERT.*)', load)
    if not 'SELECT' in load:#'INSERT' in load or 'DELETE' in load:#loadMatch:
        #print(loadMatch.group(1))
        print(load)

while True:
    sniff(prn = packet_callback, iface = 'lo', filter = 'dst port mysql', count = 1)
```
</details>

deleting and creating users do not show any interesting request. Maybe it is because there are multiple requests and the Python process time to listen again is higher than the actual process time so I miss them.

**Comment by Benjamin-Loison** [comment]
DuckDuckGo search *scapy prn real time*.

**Comment by Benjamin-Loison** [comment]
```python
try:
    packet.load
except Exception as e:
    print(type(e))
    print('my exception', e)
```
```
<class 'AttributeError'>
my exception load
```

**Comment by Benjamin-Loison** [comment]
<details>
<summary>Python script:</summary>

```python
from scapy.all import sniff
import re

def packet_callback(packet):
    try:
        packet.load
    except AttributeError:
        return
    load = packet.load.decode('ascii', errors = 'ignore')
    print(load)
    loadMatch = re.fullmatch('.*(INSERT.*)', load)
    if not 'SELECT' in load:#'INSERT' in load or 'DELETE' in load:#loadMatch:
        #print(loadMatch.group(1))
        pass#print(load)

sniff(prn = packet_callback, iface = 'lo', filter = 'dst port mysql')
```
</details>
<details>
<summary>Output:</summary>

```
SELECT `id`, `type`, `name`, `is_active`, `is_sync_enabled`, `cfg`, `created_unix`, `updated_unix` FROM `login_source` WHERE is_active=?
SELECT `id`, `type`, `name`, `is_active`, `is_sync_enabled`, `cfg`, `created_unix`, `updated_unix` FROM `login_source` WHERE is_active=?
M
M
M
M
START TRANSACTION
START TRANSACTION
SELECT `id`, `lower_name`, `name`, `full_name`, `email`, `keep_email_private`, `email_notifications_preference`, `passwd`, `passwd_hash_algo`, `must_change_password`, `login_type`, `login_source`, `login_name`, `type`, `location`, `website`, `rands`, `salt`, `language`, `description`, `created_unix`, `updated_unix`, `last_login_unix`, `last_repo_visibility`, `max_repo_creation`, `is_active`, `is_admin`, `is_restricted`, `allow_git_hook`, `allow_import_local`, `allow_create_organization`, `prohibit_login`, `avatar`, `avatar_email`, `use_custom_avatar`, `num_followers`, `num_following`, `num_stars`, `num_repos`, `num_teams`, `num_members`, `visibility`, `repo_admin_change_team_access`, `diff_view_style`, `theme`, `keep_activity_private` FROM `user` WHERE (id!=?) AND `lower_name`=? LIMIT 1
SELECT `id`, `lower_name`, `name`, `full_name`, `email`, `keep_email_private`, `email_notifications_preference`, `passwd`, `passwd_hash_algo`, `must_change_password`, `login_type`, `login_source`, `login_name`, `type`, `location`, `website`, `rands`, `salt`, `language`, `description`, `created_unix`, `updated_unix`, `last_login_unix`, `last_repo_visibility`, `max_repo_creation`, `is_active`, `is_admin`, `is_restricted`, `allow_git_hook`, `allow_import_local`, `allow_create_organization`, `prohibit_login`, `avatar`, `avatar_email`, `use_custom_avatar`, `num_followers`, `num_following`, `num_stars`, `num_repos`, `num_teams`, `num_members`, `visibility`, `repo_admin_change_team_access`, `diff_view_style`, `theme`, `keep_activity_private` FROM `user` WHERE (id!=?) AND `lower_name`=? LIMIT 1
i3m7ayrp
i3m7ayrp
N
N
|SELECT `id`, `uid`, `email`, `lower_email`, `is_activated`, `is_primary` FROM `email_address` WHERE (lower_email=?) LIMIT 1
|SELECT `id`, `uid`, `email`, `lower_email`, `is_activated`, `is_primary` FROM `email_address` WHERE (lower_email=?) LIMIT 1
test@test.com
test@test.com
O
O
1DELETE FROM `user_redirect` WHERE `lower_name`=?
1DELETE FROM `user_redirect` WHERE `lower_name`=?
i3m7ayrp
i3m7ayrp
P
P
(INSERT INTO `user` (`lower_name`,`name`,`full_name`,`email`,`keep_email_private`,`email_notifications_preference`,`passwd`,`passwd_hash_algo`,`must_change_password`,`login_type`,`login_source`,`login_name`,`type`,`location`,`website`,`rands`,`salt`,`language`,`description`,`created_unix`,`updated_unix`,`last_login_unix`,`last_repo_visibility`,`max_repo_creation`,`is_active`,`is_admin`,`is_restricted`,`allow_git_hook`,`allow_import_local`,`allow_create_organization`,`prohibit_login`,`avatar`,`avatar_email`,`use_custom_avatar`,`num_followers`,`num_following`,`num_stars`,`num_repos`,`num_teams`,`num_members`,`visibility`,`repo_admin_change_team_access`,`diff_view_style`,`theme`,`keep_activity_private`) VALUES (?,?,?,?,?,?,?,?,?,?,?,?,?,?,?,?,?,?,?,?,?,?,?,?,?,?,?,?,?,?,?,?,?,?,?,?,?,?,?,?,?,?,?,?,?)
(INSERT INTO `user` (`lower_name`,`name`,`full_name`,`email`,`keep_email_private`,`email_notifications_preference`,`passwd`,`passwd_hash_algo`,`must_change_password`,`login_type`,`login_source`,`login_name`,`type`,`location`,`website`,`rands`,`salt`,`language`,`description`,`created_unix`,`updated_unix`,`last_login_unix`,`last_repo_visibility`,`max_repo_creation`,`is_active`,`is_admin`,`is_restricted`,`allow_git_hook`,`allow_import_local`,`allow_create_organization`,`prohibit_login`,`avatar`,`avatar_email`,`use_custom_avatar`,`num_followers`,`num_following`,`num_stars`,`num_repos`,`num_teams`,`num_members`,`visibility`,`repo_admin_change_team_access`,`diff_view_style`,`theme`,`keep_activity_private`) VALUES (?,?,?,?,?,?,?,?,?,?,?,?,?,?,?,?,?,?,?,?,?,?,?,?,?,?,?,?,?,?,?,?,?,?,?,?,?,?,?,?,?,?,?,?,?)
test@test.comenabledd9020059dcb00aedc2c56e75bb17256e5e4e11e9e6f34ee60d6ba41c07f07d39278c77744aedc8d27d551e7ecd6709f71d6c1pbkdf2$50000$50 2393144f0test@test.comd9503cf2c0 41b4a5a16d819eb6c0fd0523b78723d5R|hR|h
gitea-auto
test@test.comenabledd9020059dcb00aedc2c56e75bb17256e5e4e11e9e6f34ee60d6ba41c07f07d39278c77744aedc8d27d551e7ecd6709f71d6c1pbkdf2$50000$50 2393144f0test@test.comd9503cf2c0 41b4a5a16d819eb6c0fd0523b78723d5R|hR|h
gitea-auto
Q
Q
iINSERT INTO `email_address` (`uid`,`email`,`lower_email`,`is_activated`,`is_primary`) VALUES (?,?,?,?,?)
iINSERT INTO `email_address` (`uid`,`email`,`lower_email`,`is_activated`,`is_primary`) VALUES (?,?,?,?,?)
test@test.com
test@test.com
R
R
COMMIT
COMMIT

SELECT `id`, `lower_name`, `name`, `full_name`, `email`, `keep_email_private`, `email_notifications_preference`, `passwd`, `passwd_hash_algo`, `must_change_password`, `login_type`, `login_source`, `login_name`, `type`, `location`, `website`, `rands`, `salt`, `language`, `description`, `created_unix`, `updated_unix`, `last_login_unix`, `last_repo_visibility`, `max_repo_creation`, `is_active`, `is_admin`, `is_restricted`, `allow_git_hook`, `allow_import_local`, `allow_create_organization`, `prohibit_login`, `avatar`, `avatar_email`, `use_custom_avatar`, `num_followers`, `num_following`, `num_stars`, `num_repos`, `num_teams`, `num_members`, `visibility`, `repo_admin_change_team_access`, `diff_view_style`, `theme`, `keep_activity_private` FROM `user` WHERE `id`=? LIMIT 1
```
</details>

Source: https://peerdh.com/blogs/programming-insights/building-a-real-time-packet-sniffer-using-scapy-in-python-1 > *Capturing Packets Indefinitely*

when creating a user with username `i3m7ayrp`.

Unclear why see every request twice.

**Comment by Benjamin-Loison** [comment]
Values should not be hidden as we seem to see a hash and there is no reason to encrypt just a field/transaction as far as I know.

**Comment by Benjamin-Loison** [comment]
Unclear why values are passed as `?` but actually before and after the SQL query.

**Comment by Benjamin-Loison** [comment]
```bash
sudo -u gitea GITEA_WORK_DIR=/var/lib/gitea/ /usr/local/bin/gitea web -c /etc/gitea/app.ini
```
<details>
<summary>Output:</summary>

```
2025/04/27 20:57:24 cmd/web.go:253:runWeb() [I] Starting Gitea on PID: 2677514
2025/04/27 20:57:24 cmd/web.go:112:showWebStartupMessage() [I] Gitea version: 1.23.7 built with GNU Make 4.3, go1.23.8 : bindata, sqlite, sqlite_unlock_notify
2025/04/27 20:57:24 cmd/web.go:113:showWebStartupMessage() [I] * RunMode: prod
2025/04/27 20:57:24 cmd/web.go:114:showWebStartupMessage() [I] * AppPath: /usr/local/bin/gitea
2025/04/27 20:57:24 cmd/web.go:115:showWebStartupMessage() [I] * WorkPath: /var/lib/gitea
2025/04/27 20:57:24 cmd/web.go:116:showWebStartupMessage() [I] * CustomPath: /var/lib/gitea/custom
2025/04/27 20:57:24 cmd/web.go:117:showWebStartupMessage() [I] * ConfigFile: /etc/gitea/app.ini
2025/04/27 20:57:24 cmd/web.go:118:showWebStartupMessage() [I] Prepare to run web server
2025/04/27 20:57:25 routers/init.go:117:InitWebInstalled() [I] Git version: 2.39.5 (home: /var/lib/gitea/data/home)
2025/04/27 20:57:25 routers/init.go:119:InitWebInstalled() [W] sha256 hash support is disabled - requires Git >= 2.42.
```
</details>

without additional output on successful Gitea webpage request.

**Comment by Benjamin-Loison** [comment]
<details>
<summary><code>/etc/gitea/app.ini</code>:</summary>

```ini
[database]
...
LOG_SQL = false

[log]
MODE = file
LEVEL = info
ROOT_PATH = /var/lib/gitea/log
```
</details>

may help.

**Comment by Benjamin-Loison** [comment]
DuckDuckGo search `Gitea "LOG_SQL"`.

**Comment by Benjamin-Loison** [comment]
https://docs.gitea.com/next/administration/logging-config

**Comment by Benjamin-Loison** [comment]
`LOG_SQL` does not help.

`/var/lib/gitea/log/gitea.log` seems to be what I was looking for.

**Comment by Benjamin-Loison** [comment]
<details>
<summary>Output:</summary>

```
2025/04/27 21:04:17 ...eb/routing/logger.go:102:func1() [I] router: completed POST /-/admin/users/new for XXX.XXX.XXX.XXX:0, 303 See Other in 57.5ms @ admin/users.go:112(admin.NewUserPost)
2025/04/27 21:04:17 ...eb/routing/logger.go:102:func1() [I] router: completed GET /-/admin/users/143 for XXX.XXX.XXX.XXX:0, 200 OK in 7.8ms @ admin/users.go:265(admin.ViewUser)
```
</details>

when I create a user from the administrator panel.

**Comment by Benjamin-Loison** [comment]
<details>
<summary>The person:</summary>

```
-----BEGIN PGP MESSAGE-----

hF4DTQa9Wom5MBgSAQdAe9y9kM3tJATZJz2+9Twk+CN9JqWtlxe96GSq3rocLWQw
EJHTBMWfzXBvl8q3W4KxrmRy/7DftqShEx2ClO2iRvulfRm+4vX7v4A0NlJN7tGu
0kABIxxTlKlJdSu2y+uyILkf/tdGpAMrpWYGD07OO5gWYR5FRsXiHjipU7CZFbx/
OZbqvM2+D+UYztbl4P+AJBxq
=OwHe
-----END PGP MESSAGE-----
```
</details>

does not seem to help much concerning question tags.

DuckDuckGo search *SQL VALUES question tag*.

The answers to [the Stack Overflow question 3727688](https://stackoverflow.com/q/3727688) may help.

**Comment by Benjamin-Loison** [comment]
<details>
<summary>Python script:</summary>

```python
from scapy.all import sniff
import re

def packet_callback(packet):
    try:
        packet.load
    except AttributeError:
        return
    load = packet.load.decode('ascii', errors = 'ignore')
    loadMatch = re.fullmatch('.*(INSERT INTO `user`.*)', load)
    if loadMatch:
        print(loadMatch.group(1))
        exit(0)

sniff(prn = packet_callback, iface = 'lo', filter = 'dst port mysql')
```
</details>

```sql
INSERT INTO `user` (`lower_name`,`name`,`full_name`,`email`,`keep_email_private`,`email_notifications_preference`,`passwd`,`passwd_hash_algo`,`must_change_password`,`login_type`,`login_source`,`login_name`,`type`,`location`,`website`,`rands`,`salt`,`language`,`description`,`created_unix`,`updated_unix`,`last_login_unix`,`last_repo_visibility`,`max_repo_creation`,`is_active`,`is_admin`,`is_restricted`,`allow_git_hook`,`allow_import_local`,`allow_create_organization`,`prohibit_login`,`avatar`,`avatar_email`,`use_custom_avatar`,`num_followers`,`num_following`,`num_stars`,`num_repos`,`num_teams`,`num_members`,`visibility`,`repo_admin_change_team_access`,`diff_view_style`,`theme`,`keep_activity_private`) VALUES (?,?,?,?,?,?,?,?,?,?,?,?,?,?,?,?,?,?,?,?,?,?,?,?,?,?,?,?,?,?,?,?,?,?,?,?,?,?,?,?,?,?,?,?,?)
```

except the values, it works as wanted.

**Comment by Benjamin-Loison** [comment]
Maybe can raise an exception to be less aggressive than `exit`.

**Comment by Benjamin-Loison** [comment]
<details>
<summary>Would help this other read-only use case:</summary>

```
-----BEGIN PGP MESSAGE-----

hF4DTQa9Wom5MBgSAQdAtTOd01N8AnV6CkDMDm3WL6xvprvw3/8KesRbJcraT1kw
sxQJZOYruFa3CSdRe91aRSAv4a5UDZaIcROlaNozr4+qCThl88pe59s5YEH0J+34
1LQBCQIQTJzPuK4beCYf5KArRQL0g1LHaDHZLWwwjtF3IpysDMDzSDgmcD9gEMWX
Xw5H0+Ondu1NcqQJqtu4SyPvE0qFBgYLXWjVYmVbTH2HZN5P52LX+4mBwuy4mJWW
TJy29CL4eM0Q/AZuAEDkJAHNXSMvn2Wa9h1SlOr3+Av9PldrhfzvpRJE7rcepS/v
d+cypBiGdJkcfV4mINLi03a8atcMgWIWJJA4H4qzOjkjEEyG7Is=
=0q4v
-----END PGP MESSAGE-----
```
</details>

#62 for one-time access is a workaround.
